{
  "effect_id": "EFFECT-EVIDENCE-BUNDLE-001",
  "call_id": "CALL-EVIDENCE-BUNDLE-001",
  "operation_id": "OPERATION-EVIDENCE-BUNDLE-ASSEMBLE-001",
  "operation_version": "1.0.0",
  "effect_class": "broad_write",
  "evidence_mode": "simulated",
  "authority": "simulation_only",
  "status": "simulated",
  "scope": {
    "tenant_ids": [
      "TENANT-SYNTHETIC-001"
    ],
    "resource_types": [
      "evidence_bundle"
    ],
    "record_limit": 4,
    "data_classes": [
      "synthetic"
    ],
    "environment_classes": [
      "continuous_integration"
    ]
  },
  "intended_state": "One digest-bound evidence bundle contains the four simulated substantive receipt closures and their reproduction metadata.",
  "state_before_digest": "sha256:6060606060606060606060606060606060606060606060606060606060606060",
  "state_after_digest": "sha256:7070707070707070707070707070707070707070707070707070707070707070",
  "idempotency_fingerprint": "sha256:8080808080808080808080808080808080808080808080808080808080808080",
  "external_systems": [],
  "artifact": {
    "artifact_id": "ARTIFACT-EVIDENCE-BUNDLE-001",
    "media_type": "application/json",
    "digest": "sha256:7070707070707070707070707070707070707070707070707070707070707070",
    "locator": "evidence://simulation/bundles/substantive-closure-001",
    "sensitivity": "internal",
    "retention_class": "simulation-baseline"
  },
  "occurred_at": "2026-07-28T18:20:00Z",
  "recovery": {
    "owner_role": "Simulation steward",
    "containment": "The harness retains the prior digest and marks an incomplete successor bundle as quarantined.",
    "replacement_behavior": "The replay path reuses the idempotency fingerprint and assembles from verified receipt inputs.",
    "verification": "The successor output has one bundle identifier, one digest, and a lineage link to the quarantined attempt."
  },
  "metadata": {
    "schema_version": "2.2.0",
    "created_at": "2026-07-28T18:20:00Z",
    "updated_at": "2026-07-28T18:20:00Z",
    "owner": {
      "actor_id": "OWNER-SIMULATION-001",
      "display_name": "Simulation Steward",
      "role": "Simulated effect record owner",
      "organization": "Example Laboratory"
    }
  }
}
